{
  "episodeId": "episode-1",
  "lineageId": "identity-0123456789abcdef",
  "contextRange": {
    "contextLineageId": "identity-0123456789abcdef",
    "fromContextSeq": 1,
    "toContextSeq": 2,
    "rangeHash": "bbbbbbbbbbbbbbbbbbbbbbbbbbbbbbbbbbbbbbbbbbbbbbbbbbbbbbbbbbbbbbbb"
  },
  "sourceUnitIds": [
    "u-1",
    "u-2"
  ],
  "canonicalContent": "user: hello\nassistant: hi",
  "targetGroupId": "group:identity-0123456789abcdef",
  "temporal": {
    "startedAt": "2026-08-05T00:00:00.000Z",
    "endedAt": "2026-08-05T00:01:00.000Z"
  },
  "isDerivedOnly": false,
  "derivation": {
    "memoryRefs": [],
    "compartmentIds": [
      "comp-1"
    ],
    "sourceContextUnitIds": []
  },
  "episodeSourceHash": "04ab0672c75fc146b6051d2200671cacfc22d0fa8b673fedb0fc9338fc7fe1c8"
}
